{
  "description": "Local mock configuration. Replace only with dedicated test identities and resources.",
  "identities": {
    "owner": {
      "id": "1001",
      "token": "Bearer TOKEN_ALICE_OWNER_1001",
      "parameters": {
        "user_id": "1001"
      }
    },
    "visitor": {
      "id": "1002",
      "token": "Bearer TOKEN_BOB_VISITOR_1002",
      "parameters": {
        "user_id": "1002"
      }
    },
    "anonymous": {
      "id": null,
      "token": null,
      "parameters": {}
    }
  },
  "parameter_values": {
    "GET /api/public/articles/{article_id}": {
      "article_id": 101
    },
    "GET /api/documents/{doc_uuid}": {
      "owner": {
        "doc_uuid": "550e8400-e29b-41d4-a716-446655440000"
      },
      "visitor": {
        "doc_uuid": "7d444840-9dc0-11d1-b245-5ffdce74fad2"
      }
    }
  },
  "write_allowlist": [
    "PATCH /api/users/{user_id}/settings",
    "PATCH /api/users/{user_id}/nickname"
  ],
  "readbacks": {
    "PATCH /api/users/{user_id}/settings": {
      "method": "GET",
      "path": "/api/users/{user_id}/profile",
      "consistency": "strong",
      "field_map": {
        "role": "role"
      }
    },
    "PATCH /api/users/{user_id}/nickname": {
      "method": "GET",
      "path": "/api/users/{user_id}/profile",
      "consistency": "strong",
      "field_map": {
        "role": "role"
      }
    }
  }
}
